### ISSUE TITLE
Ping: Does not show receiving multicast replies

### ISSUE THREAD

**Issue by marek22k** [iputils/iputils#526]
Hello,

when I ping the multicast address `ff02::1`, I get replies, but they are not displayed:
```
$ ip a s enp1s0f0
2: enp1s0f0: <BROADCAST,MULTICAST,UP,LOWER_UP> mtu 1500 qdisc fq_codel state UP group default qlen 1000
    link/ether 74:5d:22:f4:8d:6b brd ff:ff:ff:ff:ff:ff
    inet 192.168.8.190/24 brd 192.168.8.255 scope global dynamic noprefixroute enp1s0f0
       valid_lft 42956sec preferred_lft 42956sec
    inet6 dd28:64a0:31d0:0:a5ca:47f3:f75e:e24b/64 scope global noprefixroute 
       valid_lft forever preferred_lft forever
    inet6 fe80::9e9c:f898:48b5:9785/64 scope link noprefixroute 
       valid_lft forever preferred_lft forever
$ ping -v -c10 ff02::1%enp1s0f0
/usr/bin/ping: sock4.fd: 3 (socktype: SOCK_DGRAM), sock6.fd: 4 (socktype: SOCK_DGRAM), hints.ai_family: AF_UNSPEC

ai->ai_family: AF_INET6, ai->ai_canonname: 'ff02::1%enp1s0f0'
PING ff02::1%enp1s0f0 (ff02::1%enp1s0f0) 56 data bytes

--- ff02::1%enp1s0f0 ping statistics ---
10 packets transmitted, 0 received, 100% packet loss, time 9112ms

$ sudo tcpdump -i enp1s0f0 icmp6
tcpdump: verbose output suppressed, use -v[v]... for full protocol decode
listening on enp1s0f0, link-type EN10MB (Ethernet), snapshot length 262144 bytes
22:17:46.032237 IP6 ciel > ff02::1: ICMP6, echo request, id 58, seq 1, length 64
22:17:46.032483 IP6 fe80::cd40:b4ce:144d:33d4 > ciel: ICMP6, echo reply, id 58, seq 1, length 64
22:17:46.032634 IP6 fe80::baac:6fff:fe48:b2ae > ciel: ICMP6, echo reply, id 58, seq 1, length 64
22:17:46.032673 IP6 _gateway > ciel: ICMP6, echo reply, id 58, seq 1, length 64
22:17:46.032907 IP6 fe80::9683:c4ff:fe21:6f22 > ciel: ICMP6, echo reply, id 58, seq 1, length 64
22:17:46.035691 IP6 ciel > ciel: ICMP6, echo reply, id 58, seq 1, length 64
22:17:46.036350 IP6 fe80::d2b1:28ff:fe7e:e8e1 > ciel: ICMP6, echo reply, id 58, seq 1, length 64
22:17:47.041110 IP6 ciel > ff02::1: ICMP6, echo request, id 58, seq 2, length 64
22:17:47.041333 IP6 fe80::cd40:b4ce:144d:33d4 > ciel: ICMP6, echo reply, id 58, seq 2, length 64
22:17:47.041491 IP6 fe80::baac:6fff:fe48:b2ae > ciel: ICMP6, echo reply, id 58, seq 2, length 64
22:17:47.041491 IP6 _gateway > ciel: ICMP6, echo reply, id 58, seq 2, length 64
22:17:47.041787 IP6 fe80::9683:c4ff:fe21:6f22 > ciel: ICMP6, echo reply, id 58, seq 2, length 64
22:17:47.138553 IP6 fe80::d2b1:28ff:fe7e:e8e1 > ciel: ICMP6, echo reply, id 58, seq 2, length 64
22:17:47.144504 IP6 ciel > ciel: ICMP6, echo reply, id 58, seq 2, length 64
22:17:48.051114 IP6 ciel > ff02::1: ICMP6, echo request, id 58, seq 3, length 64
22:17:48.051342 IP6 fe80::cd40:b4ce:144d:33d4 > ciel: ICMP6, echo reply, id 58, seq 3, length 64
22:17:48.051503 IP6 _gateway > ciel: ICMP6, echo reply, id 58, seq 3, length 64
22:17:48.051503 IP6 fe80::baac:6fff:fe48:b2ae > ciel: ICMP6, echo reply, id 58, seq 3, length 64
22:17:48.051800 IP6 fe80::9683:c4ff:fe21:6f22 > ciel: ICMP6, echo reply, id 58, seq 3, length 64
22:17:48.162746 IP6 fe80::d2b1:28ff:fe7e:e8e1 > ciel: ICMP6, echo reply, id 58, seq 3, length 64
22:17:48.172834 IP6 ciel > ciel: ICMP6, echo reply, id 58, seq 3, length 64
22:17:49.064871 IP6 ciel > ff02::1: ICMP6, echo request, id 58, seq 4, length 64
22:17:49.065121 IP6 fe80::cd40:b4ce:144d:33d4 > ciel: ICMP6, echo reply, id 58, seq 4, length 64
22:17:49.065234 IP6 fe80::baac:6fff:fe48:b2ae > ciel: ICMP6, echo reply, id 58, seq 4, length 64
22:17:49.065234 IP6 _gateway > ciel: ICMP6, echo reply, id 58, seq 4, length 64
22:17:49.065539 IP6 fe80::9683:c4ff:fe21:6f22 > ciel: ICMP6, echo reply, id 58, seq 4, length 64
22:17:49.185559 IP6 ciel > ciel: ICMP6, echo reply, id 58, seq 4, length 64
22:17:49.186698 IP6 fe80::d2b1:28ff:fe7e:e8e1 > ciel: ICMP6, echo reply, id 58, seq 4, length 64
22:17:50.077837 IP6 ciel > ff02::1: ICMP6, echo request, id 58, seq 5, length 64
22:17:50.078060 IP6 fe80::cd40:b4ce:144d:33d4 > ciel: ICMP6, echo reply, id 58, seq 5, length 64
22:17:50.078189 IP6 fe80::baac:6fff:fe48:b2ae > ciel: ICMP6, echo reply, id 58, seq 5, length 64
22:17:50.078189 IP6 _gateway > ciel: ICMP6, echo reply, id 58, seq 5, length 64
22:17:50.078483 IP6 fe80::9683:c4ff:fe21:6f22 > ciel: ICMP6, echo reply, id 58, seq 5, length 64
22:17:50.212858 IP6 fe80::d2b1:28ff:fe7e:e8e1 > ciel: ICMP6, echo reply, id 58, seq 5, length 64
22:17:50.222026 IP6 ciel > ciel: ICMP6, echo reply, id 58, seq 5, length 64
22:17:50.291012 IP6 ciel > fe80::cd40:b4ce:144d:33d4: ICMP6, neighbor solicitation, who has fe80::cd40:b4ce:144d:33d4, length 32
22:17:50.291267 IP6 fe80::cd40:b4ce:144d:33d4 > ciel: ICMP6, neighbor advertisement, tgt is fe80::cd40:b4ce:144d:33d4, length 24
22:17:51.033918 IP6 _gateway > ciel: ICMP6, neighbor solicitation, who has ciel, length 32
22:17:51.033998 IP6 ciel > _gateway: ICMP6, neighbor advertisement, tgt is ciel, length 24
22:17:51.091139 IP6 ciel > ff02::1: ICMP6, echo request, id 58, seq 6, length 64
22:17:51.091352 IP6 fe80::cd40:b4ce:144d:33d4 > ciel: ICMP6, echo reply, id 58, seq 6, length 64
22:17:51.091463 IP6 fe80::baac:6fff:fe48:b2ae > ciel: ICMP6, echo reply, id 58, seq 6, length 64
22:17:51.091463 IP6 _gateway > ciel: ICMP6, echo reply, id 58, seq 6, length 64
22:17:51.091757 IP6 fe80::9683:c4ff:fe21:6f22 > ciel: ICMP6, echo reply, id 58, seq 6, length 64
22:17:51.238157 IP6 fe80::d2b1:28ff:fe7e:e8e1 > ciel: ICMP6, echo reply, id 58, seq 6, length 64
22:17:51.245256 IP6 ciel > ciel: ICMP6, echo reply, id 58, seq 6, length 64
22:17:52.104448 IP6 ciel > ff02::1: ICMP6, echo request, id 58, seq 7, length 64
22:17:52.104677 IP6 fe80::cd40:b4ce:144d:33d4 > ciel: ICMP6, echo reply, id 58, seq 7, length 64
22:17:52.104786 IP6 fe80::baac:6fff:fe48:b2ae > ciel: ICMP6, echo reply, id 58, seq 7, length 64
22:17:52.104814 IP6 _gateway > ciel: ICMP6, echo reply, id 58, seq 7, length 64
22:17:52.105107 IP6 fe80::9683:c4ff:fe21:6f22 > ciel: ICMP6, echo reply, id 58, seq 7, length 64
22:17:52.155559 IP6 ciel > ciel: ICMP6, echo reply, id 58, seq 7, length 64
22:17:53.117916 IP6 ciel > ff02::1: ICMP6, echo request, id 58, seq 8, length 64
22:17:53.118185 IP6 fe80::cd40:b4ce:144d:33d4 > ciel: ICMP6, echo reply, id 58, seq 8, length 64
22:17:53.118326 IP6 fe80::baac:6fff:fe48:b2ae > ciel: ICMP6, echo reply, id 58, seq 8, length 64
22:17:53.118326 IP6 _gateway > ciel: ICMP6, echo reply, id 58, seq 8, length 64
22:17:53.118637 IP6 fe80::9683:c4ff:fe21:6f22 > ciel: ICMP6, echo reply, id 58, seq 8, length 64
22:17:53.179542 IP6 ciel > ciel: ICMP6, echo reply, id 58, seq 8, length 64
22:17:54.131177 IP6 ciel > ff02::1: ICMP6, echo request, id 58, seq 9, length 64
22:17:54.131428 IP6 fe80::cd40:b4ce:144d:33d4 > ciel: ICMP6, echo reply, id 58, seq 9, length 64
22:17:54.131574 IP6 fe80::baac:6fff:fe48:b2ae > ciel: ICMP6, echo reply, id 58, seq 9, length 64
22:17:54.131574 IP6 _gateway > ciel: ICMP6, echo reply, id 58, seq 9, length 64
22:17:54.131868 IP6 fe80::9683:c4ff:fe21:6f22 > ciel: ICMP6, echo reply, id 58, seq 9, length 64
22:17:54.359500 IP6 ciel > ciel: ICMP6, neighbor solicitation, who has ciel, length 32
22:17:54.359557 IP6 ciel > ciel: ICMP6, neighbor advertisement, tgt is ciel, length 24
22:17:55.144478 IP6 ciel > ff02::1: ICMP6, echo request, id 58, seq 10, length 64
22:17:55.144744 IP6 fe80::cd40:b4ce:144d:33d4 > ciel: ICMP6, echo reply, id 58, seq 10, length 64
22:17:55.144792 IP6 fe80::baac:6fff:fe48:b2ae > ciel: ICMP6, echo reply, id 58, seq 10, length 64
22:17:55.144843 IP6 _gateway > ciel: ICMP6, echo reply, id 58, seq 10, length 64
22:17:55.145118 IP6 fe80::9683:c4ff:fe21:6f22 > ciel: ICMP6, echo reply, id 58, seq 10, length 64
22:17:59.248418 IP6 fe80::cd40:b4ce:144d:33d4 > ciel: ICMP6, neighbor solicitation, who has ciel, length 32
22:17:59.248483 IP6 ciel > fe80::cd40:b4ce:144d:33d4: ICMP6, neighbor advertisement, tgt is ciel, length 24
22:17:59.464433 IP6 ciel > ciel: ICMP6, neighbor solicitation, who has ciel, length 32
22:17:59.642453 IP6 ciel > ciel: ICMP6, neighbor advertisement, tgt is ciel, length 24
^C
74 packets captured
74 packets received by filter
0 packets dropped by kernel
```
`ciel` ist dabei der Name meines lokalen Computers.
Und hier das gleiche Problem ohne Namensauflösung:
```
$sudo tcpdump -i enp1s0f0 icmp6 -n
tcpdump: verbose output suppressed, use -v[v]... for full protocol decode
listening on enp1s0f0, link-type EN10MB (Ethernet), snapshot length 262144 bytes
22:20:18.771274 IP6 fe80::9e9c:f898:48b5:9785 > fe80::cd40:b4ce:144d:33d4: ICMP6, neighbor solicitation, who has fe80::cd40:b4ce:144d:33d4, length 32
22:20:18.771540 IP6 fe80::cd40:b4ce:144d:33d4 > fe80::9e9c:f898:48b5:9785: ICMP6, neighbor advertisement, tgt is fe80::cd40:b4ce:144d:33d4, length 24
22:20:19.078256 IP6 fe80::9e9c:f898:48b5:9785 > ff02::1: ICMP6, echo request, id 59, seq 1, length 64
22:20:19.078499 IP6 fe80::cd40:b4ce:144d:33d4 > fe80::9e9c:f898:48b5:9785: ICMP6, echo reply, id 59, seq 1, length 64
22:20:19.078847 IP6 fe80::baac:6fff:fe48:b2ae > fe80::9e9c:f898:48b5:9785: ICMP6, echo reply, id 59, seq 1, length 64
22:20:19.078898 IP6 fe80::9683:c4ff:fe21:f208 > fe80::9e9c:f898:48b5:9785: ICMP6, echo reply, id 59, seq 1, length 64
22:20:19.079252 IP6 fe80::9683:c4ff:fe21:6f22 > fe80::9e9c:f898:48b5:9785: ICMP6, echo reply, id 59, seq 1, length 64
22:20:20.104471 IP6 fe80::9e9c:f898:48b5:9785 > ff02::1: ICMP6, echo request, id 59, seq 2, length 64
22:20:20.104700 IP6 fe80::cd40:b4ce:144d:33d4 > fe80::9e9c:f898:48b5:9785: ICMP6, echo reply, id 59, seq 2, length 64
22:20:20.105278 IP6 fe80::baac:6fff:fe48:b2ae > fe80::9e9c:f898:48b5:9785: ICMP6, echo reply, id 59, seq 2, length 64
22:20:20.105363 IP6 fe80::9683:c4ff:fe21:f208 > fe80::9e9c:f898:48b5:9785: ICMP6, echo reply, id 59, seq 2, length 64
22:20:20.105591 IP6 fe80::9683:c4ff:fe21:6f22 > fe80::9e9c:f898:48b5:9785: ICMP6, echo reply, id 59, seq 2, length 64
22:20:20.164202 IP6 fe80::9683:c4ff:fe21:f208 > dd28:64a0:31d0:0:a5ca:47f3:f75e:e24b: ICMP6, neighbor solicitation, who has dd28:64a0:31d0:0:a5ca:47f3:f75e:e24b, length 32
22:20:20.164269 IP6 dd28:64a0:31d0:0:a5ca:47f3:f75e:e24b > fe80::9683:c4ff:fe21:f208: ICMP6, neighbor advertisement, tgt is dd28:64a0:31d0:0:a5ca:47f3:f75e:e24b, length 24
22:20:20.688530 IP6 fe80::cd40:b4ce:144d:33d4 > fe80::9e9c:f898:48b5:9785: ICMP6, neighbor solicitation, who has fe80::9e9c:f898:48b5:9785, length 32
22:20:20.688610 IP6 fe80::9e9c:f898:48b5:9785 > fe80::cd40:b4ce:144d:33d4: ICMP6, neighbor advertisement, tgt is fe80::9e9c:f898:48b5:9785, length 24
22:20:21.117872 IP6 fe80::9e9c:f898:48b5:9785 > ff02::1: ICMP6, echo request, id 59, seq 3, length 64
22:20:21.118144 IP6 fe80::cd40:b4ce:144d:33d4 > fe80::9e9c:f898:48b5:9785: ICMP6, echo reply, id 59, seq 3, length 64
22:20:21.118493 IP6 fe80::baac:6fff:fe48:b2ae > fe80::9e9c:f898:48b5:9785: ICMP6, echo reply, id 59, seq 3, length 64
22:20:21.118540 IP6 fe80::9683:c4ff:fe21:f208 > fe80::9e9c:f898:48b5:9785: ICMP6, echo reply, id 59, seq 3, length 64
22:20:21.118779 IP6 fe80::9683:c4ff:fe21:6f22 > fe80::9e9c:f898:48b5:9785: ICMP6, echo reply, id 59, seq 3, length 64
22:20:22.131465 IP6 fe80::9e9c:f898:48b5:9785 > ff02::1: ICMP6, echo request, id 59, seq 4, length 64
22:20:22.131746 IP6 fe80::cd40:b4ce:144d:33d4 > fe80::9e9c:f898:48b5:9785: ICMP6, echo reply, id 59, seq 4, length 64
22:20:22.132352 IP6 fe80::baac:6fff:fe48:b2ae > fe80::9e9c:f898:48b5:9785: ICMP6, echo reply, id 59, seq 4, length 64
22:20:22.132398 IP6 fe80::9683:c4ff:fe21:f208 > fe80::9e9c:f898:48b5:9785: ICMP6, echo reply, id 59, seq 4, length 64
22:20:22.132585 IP6 fe80::9683:c4ff:fe21:6f22 > fe80::9e9c:f898:48b5:9785: ICMP6, echo reply, id 59, seq 4, length 64
22:20:22.177060 IP6 fe80::d2b1:28ff:fe7e:e8e1 > fe80::9e9c:f898:48b5:9785: ICMP6, echo reply, id 59, seq 4, length 64
22:20:22.189831 IP6 fe80::6d2e:e139:2843:29b8 > fe80::9e9c:f898:48b5:9785: ICMP6, echo reply, id 59, seq 4, length 64
22:20:23.145044 IP6 fe80::9e9c:f898:48b5:9785 > ff02::1: ICMP6, echo request, id 59, seq 5, length 64
22:20:23.145301 IP6 fe80::cd40:b4ce:144d:33d4 > fe80::9e9c:f898:48b5:9785: ICMP6, echo reply, id 59, seq 5, length 64
22:20:23.146091 IP6 fe80::9683:c4ff:fe21:f208 > fe80::9e9c:f898:48b5:9785: ICMP6, echo reply, id 59, seq 5, length 64
22:20:23.146170 IP6 fe80::baac:6fff:fe48:b2ae > fe80::9e9c:f898:48b5:9785: ICMP6, echo reply, id 59, seq 5, length 64
22:20:23.146463 IP6 fe80::9683:c4ff:fe21:6f22 > fe80::9e9c:f898:48b5:9785: ICMP6, echo reply, id 59, seq 5, length 64
22:20:23.198106 IP6 fe80::6d2e:e139:2843:29b8 > fe80::9e9c:f898:48b5:9785: ICMP6, echo reply, id 59, seq 5, length 64
22:20:23.204052 IP6 fe80::d2b1:28ff:fe7e:e8e1 > fe80::9e9c:f898:48b5:9785: ICMP6, echo reply, id 59, seq 5, length 64
22:20:24.084167 IP6 fe80::9683:c4ff:fe21:f208 > fe80::9e9c:f898:48b5:9785: ICMP6, neighbor solicitation, who has fe80::9e9c:f898:48b5:9785, length 32
22:20:24.084219 IP6 fe80::9e9c:f898:48b5:9785 > fe80::9683:c4ff:fe21:f208: ICMP6, neighbor advertisement, tgt is fe80::9e9c:f898:48b5:9785, length 24
22:20:24.141271 IP6 fe80::9683:c4ff:fe21:6f22 > fe80::9e9c:f898:48b5:9785: ICMP6, neighbor solicitation, who has fe80::9e9c:f898:48b5:9785, length 32
22:20:24.141333 IP6 fe80::9e9c:f898:48b5:9785 > fe80::9683:c4ff:fe21:6f22: ICMP6, neighbor advertisement, tgt is fe80::9e9c:f898:48b5:9785, length 24
22:20:24.157803 IP6 fe80::9e9c:f898:48b5:9785 > ff02::1: ICMP6, echo request, id 59, seq 6, length 64
22:20:24.158027 IP6 fe80::cd40:b4ce:144d:33d4 > fe80::9e9c:f898:48b5:9785: ICMP6, echo reply, id 59, seq 6, length 64
22:20:24.158643 IP6 fe80::baac:6fff:fe48:b2ae > fe80::9e9c:f898:48b5:9785: ICMP6, echo reply, id 59, seq 6, length 64
22:20:24.158730 IP6 fe80::9683:c4ff:fe21:f208 > fe80::9e9c:f898:48b5:9785: ICMP6, echo reply, id 59, seq 6, length 64
22:20:24.158936 IP6 fe80::9683:c4ff:fe21:6f22 > fe80::9e9c:f898:48b5:9785: ICMP6, echo reply, id 59, seq 6, length 64
22:20:24.225950 IP6 fe80::d2b1:28ff:fe7e:e8e1 > fe80::9e9c:f898:48b5:9785: ICMP6, echo reply, id 59, seq 6, length 64
22:20:24.229631 IP6 fe80::6d2e:e139:2843:29b8 > fe80::9e9c:f898:48b5:9785: ICMP6, echo reply, id 59, seq 6, length 64
22:20:24.249646 IP6 fe80::baac:6fff:fe48:b2ae > fe80::9e9c:f898:48b5:9785: ICMP6, neighbor solicitation, who has fe80::9e9c:f898:48b5:9785, length 32
22:20:24.249707 IP6 fe80::9e9c:f898:48b5:9785 > fe80::baac:6fff:fe48:b2ae: ICMP6, neighbor advertisement, tgt is fe80::9e9c:f898:48b5:9785, length 24
22:20:25.171140 IP6 fe80::9e9c:f898:48b5:9785 > ff02::1: ICMP6, echo request, id 59, seq 7, length 64
22:20:25.171403 IP6 fe80::cd40:b4ce:144d:33d4 > fe80::9e9c:f898:48b5:9785: ICMP6, echo reply, id 59, seq 7, length 64
22:20:25.171812 IP6 fe80::baac:6fff:fe48:b2ae > fe80::9e9c:f898:48b5:9785: ICMP6, echo reply, id 59, seq 7, length 64
22:20:25.171892 IP6 fe80::9683:c4ff:fe21:f208 > fe80::9e9c:f898:48b5:9785: ICMP6, echo reply, id 59, seq 7, length 64
22:20:25.172100 IP6 fe80::9683:c4ff:fe21:6f22 > fe80::9e9c:f898:48b5:9785: ICMP6, echo reply, id 59, seq 7, length 64
22:20:25.245594 IP6 fe80::6d2e:e139:2843:29b8 > fe80::9e9c:f898:48b5:9785: ICMP6, echo reply, id 59, seq 7, length 64
22:20:25.249968 IP6 fe80::d2b1:28ff:fe7e:e8e1 > fe80::9e9c:f898:48b5:9785: ICMP6, echo reply, id 59, seq 7, length 64
22:20:26.184465 IP6 fe80::9e9c:f898:48b5:9785 > ff02::1: ICMP6, echo request, id 59, seq 8, length 64
22:20:26.184687 IP6 fe80::cd40:b4ce:144d:33d4 > fe80::9e9c:f898:48b5:9785: ICMP6, echo reply, id 59, seq 8, length 64
22:20:26.185676 IP6 fe80::baac:6fff:fe48:b2ae > fe80::9e9c:f898:48b5:9785: ICMP6, echo reply, id 59, seq 8, length 64
22:20:26.185762 IP6 fe80::9683:c4ff:fe21:f208 > fe80::9e9c:f898:48b5:9785: ICMP6, echo reply, id 59, seq 8, length 64
22:20:26.185971 IP6 fe80::9683:c4ff:fe21:6f22 > fe80::9e9c:f898:48b5:9785: ICMP6, echo reply, id 59, seq 8, length 64
22:20:26.270132 IP6 fe80::6d2e:e139:2843:29b8 > fe80::9e9c:f898:48b5:9785: ICMP6, echo reply, id 59, seq 8, length 64
22:20:26.272585 IP6 fe80::d2b1:28ff:fe7e:e8e1 > fe80::9e9c:f898:48b5:9785: ICMP6, echo reply, id 59, seq 8, length 64
22:20:27.186379 IP6 fe80::d2b1:28ff:fe7e:e8e1 > fe80::9e9c:f898:48b5:9785: ICMP6, neighbor solicitation, who has fe80::9e9c:f898:48b5:9785, length 32
22:20:27.186512 IP6 fe80::9e9c:f898:48b5:9785 > fe80::d2b1:28ff:fe7e:e8e1: ICMP6, neighbor advertisement, tgt is fe80::9e9c:f898:48b5:9785, length 24
22:20:27.197887 IP6 fe80::9e9c:f898:48b5:9785 > ff02::1: ICMP6, echo request, id 59, seq 9, length 64
22:20:27.198149 IP6 fe80::cd40:b4ce:144d:33d4 > fe80::9e9c:f898:48b5:9785: ICMP6, echo reply, id 59, seq 9, length 64
22:20:27.198861 IP6 fe80::baac:6fff:fe48:b2ae > fe80::9e9c:f898:48b5:9785: ICMP6, echo reply, id 59, seq 9, length 64
22:20:27.198927 IP6 fe80::9683:c4ff:fe21:f208 > fe80::9e9c:f898:48b5:9785: ICMP6, echo reply, id 59, seq 9, length 64
22:20:27.199158 IP6 fe80::9683:c4ff:fe21:6f22 > fe80::9e9c:f898:48b5:9785: ICMP6, echo reply, id 59, seq 9, length 64
22:20:27.296645 IP6 fe80::d2b1:28ff:fe7e:e8e1 > fe80::9e9c:f898:48b5:9785: ICMP6, echo reply, id 59, seq 9, length 64
22:20:27.306058 IP6 fe80::6d2e:e139:2843:29b8 > fe80::9e9c:f898:48b5:9785: ICMP6, echo reply, id 59, seq 9, length 64
22:20:27.306058 IP6 fe80::6d2e:e139:2843:29b8 > fe80::9e9c:f898:48b5:9785: ICMP6, neighbor solicitation, who has fe80::9e9c:f898:48b5:9785, length 32
22:20:27.306080 IP6 fe80::9e9c:f898:48b5:9785 > fe80::6d2e:e139:2843:29b8: ICMP6, neighbor advertisement, tgt is fe80::9e9c:f898:48b5:9785, length 24
22:20:28.211171 IP6 fe80::9e9c:f898:48b5:9785 > ff02::1: ICMP6, echo request, id 59, seq 10, length 64
22:20:28.211405 IP6 fe80::cd40:b4ce:144d:33d4 > fe80::9e9c:f898:48b5:9785: ICMP6, echo reply, id 59, seq 10, length 64
22:20:28.212007 IP6 fe80::baac:6fff:fe48:b2ae > fe80::9e9c:f898:48b5:9785: ICMP6, echo reply, id 59, seq 10, length 64
22:20:28.212088 IP6 fe80::9683:c4ff:fe21:f208 > fe80::9e9c:f898:48b5:9785: ICMP6, echo reply, id 59, seq 10, length 64
22:20:28.212298 IP6 fe80::9683:c4ff:fe21:6f22 > fe80::9e9c:f898:48b5:9785: ICMP6, echo reply, id 59, seq 10, length 64
22:20:28.320275 IP6 fe80::d2b1:28ff:fe7e:e8e1 > fe80::9e9c:f898:48b5:9785: ICMP6, echo reply, id 59, seq 10, length 64
22:20:28.329906 IP6 fe80::6d2e:e139:2843:29b8 > fe80::9e9c:f898:48b5:9785: ICMP6, echo reply, id 59, seq 10, length 64
22:20:29.224371 IP6 fe80::9e9c:f898:48b5:9785 > fe80::9683:c4ff:fe21:6f22: ICMP6, neighbor solicitation, who has fe80::9683:c4ff:fe21:6f22, length 32
22:20:29.224770 IP6 fe80::9683:c4ff:fe21:6f22 > fe80::9e9c:f898:48b5:9785: ICMP6, neighbor advertisement, tgt is fe80::9683:c4ff:fe21:6f22, length 24
22:20:29.437675 IP6 fe80::9e9c:f898:48b5:9785 > fe80::baac:6fff:fe48:b2ae: ICMP6, neighbor solicitation, who has fe80::baac:6fff:fe48:b2ae, length 32
22:20:29.437841 IP6 fe80::baac:6fff:fe48:b2ae > fe80::9e9c:f898:48b5:9785: ICMP6, neighbor advertisement, tgt is fe80::baac:6fff:fe48:b2ae, length 24
22:20:32.211511 IP6 fe80::9e9c:f898:48b5:9785 > fe80::d2b1:28ff:fe7e:e8e1: ICMP6, neighbor solicitation, who has fe80::d2b1:28ff:fe7e:e8e1, length 32
22:20:32.421251 IP6 fe80::d2b1:28ff:fe7e:e8e1 > fe80::9e9c:f898:48b5:9785: ICMP6, neighbor advertisement, tgt is fe80::d2b1:28ff:fe7e:e8e1, length 24
22:20:32.424356 IP6 fe80::9e9c:f898:48b5:9785 > fe80::6d2e:e139:2843:29b8: ICMP6, neighbor solicitation, who has fe80::6d2e:e139:2843:29b8, length 32
22:20:32.630465 IP6 fe80::6d2e:e139:2843:29b8 > fe80::9e9c:f898:48b5:9785: ICMP6, neighbor advertisement, tgt is fe80::6d2e:e139:2843:29b8, length 24
^C
88 packets captured
88 packets received by filter
0 packets dropped by kernel
```

The problem also exists with the latest version (commit 3400f3a740942064a545f02aabcf68e234733297) from the Git repository:
```
$./ping/ping -v -c10 ff02::1%enp1s0f0
./ping/ping: sock4.fd: 3 (socktype: SOCK_DGRAM), sock6.fd: 4 (socktype: SOCK_DGRAM), hints.ai_family: AF_UNSPEC

ai->ai_family: AF_INET6, ai->ai_canonname: 'ff02::1%enp1s0f0'
PING ff02::1%enp1s0f0 (ff02::1%enp1s0f0) 56 data bytes

--- ff02::1%enp1s0f0 ping statistics ---
10 packets transmitted, 0 received, 100% packet loss, time 9118ms
```

Version: `20240117-1`
OS: Arch Linux

**Comment by pevik** [comment]
I have no idea what is wrong. Isn't it somehow related to `fq_codel`? For me is multicast ping working on all my interfaces (various real and virtual ones).

**Comment by marek22k** [comment]
I just tried again and apparently it was a problem with my firewall. I'm sorry I didn't notice this earlier and create the issue.
