### ISSUE TITLE
ping -I doesn't properly handle 'lo' source interface

### ISSUE THREAD

**Issue by nmeyerhans** [iputils/iputils#198]
Forwarded from https://bugs.debian.org/cgi-bin/bugreport.cgi?bug=438727

This behavior was reported ages ago, but is still present in master. From the original report:

> The man page for ping states that the (source) interface address may be
specified by using the option -I followed by the ip address or interface
name.
But the interface name lo (as listed in the output of ifconfig) is not
correctly transformed to the ip address attached to the loopback
interface. Instead (at least in my case) the ip address from the
interface eth0 is used.
The option '-I eth0' works correctly.
>
> In the following transcripts you can see the specified interface and the
used (source) ip address in the first line of output. (I think the two
following commands should be equal.)
>
> $ ping -I lo 192.168.1.2  # wrong source ip address used
PING 192.168.1.2 (192.168.1.2) from 192.168.1.2 lo: 56(84) bytes of data.
64 bytes from 192.168.1.2: icmp_seq=1 ttl=64 time=0.156 ms
>
> $ ping -I 127.0.0.1 192.168.1.2  # correct source ip address used
PING 192.168.1.2 (192.168.1.2) from 127.0.0.1 : 56(84) bytes of data.
64 bytes from 192.168.1.2: icmp_seq=1 ttl=64 time=0.183 ms
>
> The output of the above specified ping commands corresponds to the
actually used source ip address in the ip packets (verified with wireshark).

I've confirmed the behavior. Tcpdump output with '-I lo' and '-I 127.0.0.1' are shown below:

-I lo:
```
09:37:23.179330 IP 192.168.0.206 > 192.168.0.206: ICMP echo request, id 6589, seq 1, length 64
09:37:23.179342 IP 192.168.0.206 > 192.168.0.206: ICMP echo reply, id 6589, seq 1, length 64
09:37:24.211582 IP 192.168.0.206 > 192.168.0.206: ICMP echo request, id 6589, seq 2, length 64
09:37:24.211611 IP 192.168.0.206 > 192.168.0.206: ICMP echo reply, id 6589, seq 2, length 64
09:37:25.235583 IP 192.168.0.206 > 192.168.0.206: ICMP echo request, id 6589, seq 3, length 64
09:37:25.235612 IP 192.168.0.206 > 192.168.0.206: ICMP echo reply, id 6589, seq 3, length 64
```

-I 127.0.0.1:
```
09:37:32.812240 IP 127.0.0.1 > 192.168.0.206: ICMP echo request, id 6601, seq 1, length 64
09:37:32.812256 IP 192.168.0.206 > 127.0.0.1: ICMP echo reply, id 6601, seq 1, length 64
09:37:33.843584 IP 127.0.0.1 > 192.168.0.206: ICMP echo request, id 6601, seq 2, length 64
09:37:33.843617 IP 192.168.0.206 > 127.0.0.1: ICMP echo reply, id 6601, seq 2, length 64
09:37:34.867521 IP 127.0.0.1 > 192.168.0.206: ICMP echo request, id 6601, seq 3, length 64
09:37:34.867549 IP 192.168.0.206 > 127.0.0.1: ICMP echo reply, id 6601, seq 3, length 64
```

Note the difference in source address. I would expect the 'lo' behavior to be identical to the '127.0.0.1' behavior.

**Comment by pevik** [comment]
Thanks for a report, I'll try to look into it.

**Comment by pevik** [comment]
Not sure if I'm testing with the same scenario as you. In my case `192.168.0.109` is address of my `eth0` device. `tcpdump` for `lo` is working (i.e. showing correct address `192.168.0.109`):

```
$ ping -c1 -I lo 192.168.0.109
ping: Warning: source address might be selected on device other than: lo
PING 192.168.0.109 (192.168.0.109) from 192.168.0.109 lo: 56(84) bytes of data.
64 bytes from 192.168.0.109: icmp_seq=1 ttl=64 time=0.102 ms

$ tcpdump -n -i lo icmp
02:08:49.972065 IP 192.168.0.109 > 192.168.0.109: ICMP echo request, id 1087, seq 1, length 64
02:08:49.972090 IP 192.168.0.109 > 192.168.0.109: ICMP echo reply, id 1087, seq 1, length 64
```

Can you please specify your setup so we can reproduce it? Are you sure it hasn't been fixed?

BTW `-I device` is (deliberately) treated different way than `-I address`. You get warning if you use `-I lo` for local address which is not on `lo` (or any remote address as it's not possible to route over `lo`).
 `-l 127.0.0.1` (or any other address) `ping` binds directly to that address whereas `-I lo` (or any other device) `ping` uses `setsockopt(sock->fd, SOL_SOCKET, SO_BINDTODEVICE, "", 0)` to bind to device. But this can be only on interface which has both source and destination address on this device (or for other than `lo` devices destination address must be routable over this device), otherwise there is the above mentioned warning.

There could be improvement to find the actually used device and if it's different, instead of `Warning: source address might be selected on device other than: lo` it should print `Warning: source address selected on device foo instead of lo` and then print this device in output:
`PING 192.168.0.109 (192.168.0.109) from 192.168.0.109 foo: 56(84) bytes of data.`
This would require another loop over interfaces (data got from `getifaddrs()`).

**Comment by nmeyerhans** [comment]
The behavior you're observing is precisely the behavior that the original reporter of the issue found to be incorrect (or at least unexpected/confusing). The expected that the source IP address would be the same given either `-I lo` or `-I 127.0.0.1`. That is, in neither of those cases would a source IP address from `eth0` be used. The observed behavior is that a source address was chosen from `eth0` when `-I lo` was specified.

> BTW -I device is (deliberately) treated different way than -I address. You get warning if you use -I lo for local address which is not on lo (or any remote address as it's not possible to route over lo).
-l 127.0.0.1 (or any other address) ping binds directly to that address whereas -I lo (or any other device) ping uses setsockopt(sock->fd, SOL_SOCKET, SO_BINDTODEVICE, "", 0) to bind to device. But this can be only on interface which has both source and destination address on this device (or for other than lo devices destination address must be routable over this device), otherwise there is the above mentioned warning.

I don't think that's the right behavior. There certainly doesn't need to be a warning. Local addresses on non-loopback interface are still reached over the loopback interface. I can envision legitimate use-cases for this behavior, for example testing to see if a floating IP address is configured on the local machine.

Furthermore, the code you mentioned: `setsockopt(sock->fd, SOL_SOCKET, SO_BINDTODEVICE, "", 0)` (line [658](https://github.com/iputils/iputils/blame/c81f2309b912a00d943afd887616c00a5984c283/ping.c#L658)) is not binding to an interface, it is removing a binding from interface that had previously been installed [on line 592](https://github.com/iputils/iputils/blame/c81f2309b912a00d943afd887616c00a5984c283/ping.c#L592). I actually think that line is incorrect, and I think the behavior introduced by that commit is buggy. If I bind to (for example) `eth0` and try to ping an IP address on `eth0`, that ping **should** fail, because the traffic does not traverse `eth0`, but `lo`. Removing the binding to make the ping work wasn't the right thing to do there, dropping the packets was. But maybe that belongs in another issue...

**Comment by pevik** [comment]
> The behavior you're observing is precisely the behavior that the original reporter of the issue found to be incorrect (or at least unexpected/confusing). They expected that the source IP address would be the same given either `-I lo` or `-I 127.0.0.1`. That is, in neither of those cases would a source IP address from `eth0` be used. The observed behavior is that a source address was chosen from `eth0` when `-I lo` was specified.

IMHO YOSHIFUJI Hideaki (author of ping) should chosen different flag than `-I` for binding to device. But too late now. This comes from import of iputils into github from ftp://ftp.inr.ac.ru/ip-routing/iputils-ss020927.tar.gz (33370345c7d8c217b51c13b0e2864b64b53d5f96).

> > BTW -I device is (deliberately) treated different way than -I address. You get warning if you use -I lo for local address which is not on lo (or any remote address as it's not possible to route over lo).
> > -l 127.0.0.1 (or any other address) ping binds directly to that address whereas -I lo (or any other device) ping uses setsockopt(sock->fd, SOL_SOCKET, SO_BINDTODEVICE, "", 0) to bind to device. But this can be only on interface which has both source and destination address on this device (or for other than lo devices destination address must be routable over this device), otherwise there is the above mentioned warning.
> 
> I don't think that's the right behavior. There certainly doesn't need to be a warning. Local addresses on non-loopback interface are still reached over the loopback interface. I can envision legitimate use-cases for this behavior, for example testing to see if a floating IP address is configured on the local machine.

Original behavior is quite old, comes from 63579a1b5bf61f0e03dd4e815386170d684797f7 (s20121205, the original author) + fix in 961cac1deeb1325d45f46dbbe20a922fa08746c1. So warning was here before `-I device` 

> 
> Furthermore, the code you mentioned: `setsockopt(sock->fd, SOL_SOCKET, SO_BINDTODEVICE, "", 0)` (line [658](https://github.com/iputils/iputils/blame/c81f2309b912a00d943afd887616c00a5984c283/ping.c#L658)) is not binding to an interface, it is removing a binding from interface that had previously been installed [on line 592](https://github.com/iputils/iputils/blame/c81f2309b912a00d943afd887616c00a5984c283/ping.c#L592). 

You're right, sorry.

> I actually think that line is incorrect, and I think the behavior introduced by [that commit](https://github.com/iputils/iputils/commit/cc44f4c5c2e72f7aa833658a6978d924ff9e059d) is buggy. If I bind to (for example) `eth0` and try to ping an IP address on `eth0`, that ping **should** fail, because the traffic does not traverse `eth0`, but `lo`. Removing the binding to make the ping work wasn't the right thing to do there, dropping the packets was. But maybe that belongs in another issue...

Hmm, agree. This is a result of #104 f455fee41c077d4b700a473b2f5b3487b8febc1d. @jsynacek @kerolasa WDYT? I'd be for reverting cc44f4c5c2e72f7aa833658a6978d924ff9e059d.

**Comment by nmeyerhans** [comment]
> IMHO YOSHIFUJI Hideaki (author of ping) should chosen different flag than -I for binding to device. But too late now. This comes from import of iputils into github from ftp://ftp.inr.ac.ru/ip-routing/iputils-ss020927.tar.gz

Yeah, if you don't want to change the behavior, I think it's probably sufficient to update the description of the `-I` flag in the man page. It would be good to note that `-I DEVICE` does not override the kernel's default source address selection behavior. I can try to write something meaningful and send a PR if you'd like.

> Hmm, agree. This is a result of #104 f455fee. @jsynacek @kerolasa WDYT? I'd be for reverting cc44f4c.

:+1:

**Comment by kerolasa** [comment]
> Hmm, agree. This is a result of #104 f455fee. @jsynacek @kerolasa WDYT? I'd be for reverting cc44f4c.

Yes, reverting cc44f4c seems to be the most reasonable thing to do. And it would be really good to get a note to manual page telling what one can expect when defining interface and pinging local addresses.

**Comment by ValZapod** [comment]
I suppose "solved" with https://github.com/iputils/iputils/commit/9e08707d743b29e853df81bd7def1729e3afe55d.

**Comment by pevik** [comment]
It'd require more changes than just simple reverting cc44f4c.
Although the result is then the same (100% packet loss) warning and sendmsg error shows that code goes quite different way. I'd have to dig more into the issue, help or patches is welcomed.

```
$ ./builddir/ping -c1 -I lo 8.8.8.8
./builddir/ping: Warning: source address might be selected on device other than: lo
PING 8.8.8.8 (8.8.8.8) from 192.168.5.104 lo: 56(84) bytes of data.

--- 8.8.8.8 ping statistics ---
1 packets transmitted, 0 received, 100% packet loss, time 0ms

$ ./builddir/ping -c1 -I 127.0.0.1 8.8.8.8
PING 8.8.8.8 (8.8.8.8) from 127.0.0.1 : 56(84) bytes of data.
./builddir/ping: sendmsg: Invalid argument

--- 8.8.8.8 ping statistics ---
1 packets transmitted, 0 received, 100% packet loss, time 0ms
```

(error is from [ping_common.c:476](https://github.com/iputils/iputils/blob/master/ping_common.c#L476)`)

**Comment by pruddy-vyatta** [comment]
take a look at the patch for the -Z option to use the src address of an interface I have here and see if it suits. 

https://github.com/iputils/iputils/compare/master...pruddy-vyatta:push-ping-x-patch?expand=1

**Comment by ValZapod** [comment]
Can be closed, was a bug in the kernel. 
https://github.com/torvalds/linux/commit/38c73529de13e1e10914de7030b659a2f8b01c3b
https://github.com/torvalds/linux/commit/19e4e768064a87b073a4b4c138b55db70e0cfb9f

**Comment by okias** [comment]
Feel free to reopen, if you'll see it on kernels with fixes.
