### ISSUE TITLE
Wrong host reported. 

### ISSUE THREAD

**Issue by rewolff** [iputils/iputils#34]
Sometimes I start a ping and come back days later to find it oddly reporting return packets from the source host itself. 
```
64 bytes from abra2.bitwizard.nl (192.168.234.34): icmp_seq=32960 ttl=64 time=0.132 ms
64 bytes from abra2.bitwizard.nl (192.168.234.34): icmp_seq=32961 ttl=64 time=0.157 ms
^C
--- falbala.bitwizard.nl ping statistics ---
1474753 packets transmitted, 1474028 received, +575 errors, 0% packet loss, time 1474755201ms
rtt min/avg/max/mdev = 0.055/0.160/253.260/0.538 ms, pipe 3
abra2:~> ping falbala
PING falbala.bitwizard.nl (192.168.234.32) 56(84) bytes of data.
64 bytes from falbala.bitwizard.nl (192.168.234.32): icmp_seq=1 ttl=64 time=0.143 ms
...
64 bytes from falbala.bitwizard.nl (192.168.234.32): icmp_seq=5 ttl=64 time=0.140 ms
^C
--- falbala.bitwizard.nl ping statistics ---
5 packets transmitted, 5 received, 0% packet loss, time 3999ms
rtt min/avg/max/mdev = 0.137/0.147/0.162/0.014 ms
```
I'm suspecting that the 
```
From 192.168.234.34 icmp_seq=1 Destination Host Unreachable
```
carries over to when the host comes back. 

Oh. The ping times reported at first seem to indicate that the packets actually DO travel over the link to the remote host and back.

**Comment by itsuugo** [comment]
It's easy to reproduce using 2 hosts (4.4.4.21 and 4.4.4.78 per example) in the same l2 segment. I can't reproduce it if the hosts are in different subnets so the suspect should be certain.

Shutdown one server and start to ping from the other. You start to see a lot `destination unreachable`

```
# ping 4.4.4.78
PING 4.4.4.78 (4.4.4.78) 56(84) bytes of data.
From 4.4.4.21 icmp_seq=10 Destination Host Unreachable
From 4.4.4.21 icmp_seq=11 Destination Host Unreachable
From 4.4.4.21 icmp_seq=12 Destination Host Unreachable
From 4.4.4.21 icmp_seq=13 Destination Host Unreachable
```

Then, start the server and when the connectivity is recovered you can see that the ICMP src address is the ip address of the current host

```
From 4.4.4.21 icmp_seq=65 Destination Host Unreachable
From 4.4.4.21 icmp_seq=66 Destination Host Unreachable
64 bytes from 4.4.4.21: icmp_seq=67 ttl=64 time=13.5 ms
64 bytes from 4.4.4.21: icmp_seq=68 ttl=64 time=3.67 ms
64 bytes from 4.4.4.21: icmp_seq=69 ttl=64 time=4.68 ms
64 bytes from 4.4.4.21: icmp_seq=70 ttl=64 time=5.19 ms
64 bytes from 4.4.4.21: icmp_seq=71 ttl=64 time=3.87 ms
64 bytes from 4.4.4.21: icmp_seq=72 ttl=64 time=5.67 ms
64 bytes from 4.4.4.21: icmp_seq=73 ttl=64 time=4.63 ms
^C
--- 4.4.4.78 ping statistics ---
73 packets transmitted, 7 received, +66 errors, 90% packet loss, time 72359ms
rtt min/avg/max/mdev = 3.676/5.902/13.575/3.197 ms, pipe 3
```

If you capture the traffic the headers are correct 

```
22:22:52.952564 IP 4.4.4.21 > 4.4.4.78: ICMP echo request, id 1291, seq 8, length 64
22:22:53.952561 IP 4.4.4.21 > 4.4.4.78: ICMP echo request, id 1291, seq 9, length 64
22:23:12.959702 IP 4.4.4.21 > 4.4.4.78: ICMP echo request, id 1291, seq 28, length 64
22:23:12.967272 IP 4.4.4.78 > 4.4.4.21: ICMP echo reply, id 1291, seq 28, length 64
22:23:13.954650 IP 4.4.4.21 > 4.4.4.78: ICMP echo request, id 1291, seq 29, length 64
22:23:13.959093 IP 4.4.4.78 > 4.4.4.21: ICMP echo reply, id 1291, seq 29, length 64
22:23:14.955786 IP 4.4.4.21 > 4.4.4.78: ICMP echo request, id 1291, seq 30, length 6
````

**Comment by vmule** [comment]
I'm not able to reproduce it:

**Comment by rewolff** [comment]
Only the third computer that I tried has the bug... 
has the bug: ping utility, iputils-s20121221  // ubuntu 14.04
Does not have the bug: ping utility, iputils-s20121221 // ubuntu 15.10
does not have the bug: ping utility, iputils-s20121221  // ubuntu 16.04

It seems that "the version of ping" is not the influence.... 
I just tried again, and the 14.04 machine reproduced the bug again, and teh 15.10 one did not. 

To test: pick a host  NOT on your local network (and not the one you're working from), in one window, type **route add <thehost> eth0**.  Now type **ping <thehost>**, in another window. Await a few "host unreachable" messages before you do **route del <thehost>** in the first window. 

OK. Got to the bottom of this. Between Ubuntu 14.04 and 15.10 Ubuntu applied this patch. Shown in REVERSE here. lines marked with - are the BETTER ones. 

```

--- ping.c      2016-05-17 08:10:11.000000000 +0200
+++ /home/wolff/pingg/iputils-20121221/ping.c   2016-05-17 08:03:34.000000000 +0200
@@ -1244,13 +1244,10 @@
 {
        struct hostent *hp;
        static char buf[4096] = "";
-       static __u32 last_addr = 0;
 
-       if (*buf && addr == last_addr)
+       if (*buf)
                return(buf);
 
-       last_addr = addr;
-
        in_pr_addr = !setjmp(pr_addr_jmp);
 
        if (exiting || (options & F_NUMERIC) ||

```

**Comment by okias** [comment]
@rewolff after ping and ping6 merge we use these days completly different codebase, can you test with our (new) ping?

@pavlix changed these lines in commit 7ddd66a5e9a6d42359ae56282e26daed63421ce5

**Comment by okias** [comment]
Also I created brief bugreport, about following debian steps in adopting "our" iputils :)

https://bugs.launchpad.net/ubuntu/+source/iputils/+bug/1582851

**Comment by rewolff** [comment]
OK. Tested! I cloned the git repo, installed the build-deps for the PACKAGE in my ubuntu dist (16.04) and built ping. Then without installing, I did sudo ./ping rpi and the replies were reported from the correct host. 

So... Yes I think it is fixed in the current version!
(it was a pretty stupid bug to begin with actually... if I understand the code correctly......)

**Comment by okias** [comment]
@rewolff thanks for testing, feel free point this bug on ubuntu launchpad.
